1;Jan 10, 2003 04:34:12.870401000 EST;65.240.185.205;2335;131.243.2.12;21;6;48;TCP;2335 → 21 [SYN] Seq=0 Win=16384 Len=0 MSS=1460 SACK_PERM=1
2;Jan 10, 2003 04:34:12.870741000 EST;131.243.2.12;21;65.240.185.205;2335;6;48;TCP;21 → 2335 [SYN, ACK] Seq=0 Ack=1 Win=64240 Len=0 SACK_PERM=1 MSS=1460
3;Jan 10, 2003 04:34:13.050626000 EST;65.240.185.205;2335;131.243.2.12;21;6;40;TCP;2335 → 21 [ACK] Seq=1 Ack=1 Win=17520 Len=0
4;Jan 10, 2003 04:34:13.274193000 EST;131.243.2.12;21;65.240.185.205;2335;6;123;FTP;Response: 220 <domain> FTP server (Version wu-2.6.2(1) Fri Nov 30 16:58:35 PST 2001) ready.
5;Jan 10, 2003 04:34:13.455582000 EST;65.240.185.205;2335;131.243.2.12;21;6;56;FTP;Request: USER anonymous
6;Jan 10, 2003 04:34:13.455754000 EST;131.243.2.12;21;65.240.185.205;2335;6;40;TCP;21 → 2335 [ACK] Seq=84 Ack=17 Win=64240 Len=0
7;Jan 10, 2003 04:34:13.458555000 EST;131.243.2.12;21;65.240.185.205;2335;6;108;FTP;Response: 331 Guest login ok, send your complete e-mail address as password.
8;Jan 10, 2003 04:34:13.638390000 EST;65.240.185.205;2335;131.243.2.12;21;6;57;FTP;Request: PASS <password>
9;Jan 10, 2003 04:34:13.644260000 EST;131.243.2.12;21;65.240.185.205;2335;6;106;FTP;Response: 230-The Lawrence Berkeley National Laboratory is operated by the
10;Jan 10, 2003 04:34:13.947288000 EST;65.240.185.205;2335;131.243.2.12;21;6;40;TCP;2335 → 21 [ACK] Seq=34 Ack=218 Win=17297 Len=0
11;Jan 10, 2003 04:34:13.947751000 EST;131.243.2.12;21;65.240.185.205;2335;6;1481;FTP;Response: 230-University of California for the United States Department of
12;Jan 10, 2003 04:34:14.247941000 EST;65.240.185.205;2335;131.243.2.12;21;6;40;TCP;2335 → 21 [ACK] Seq=34 Ack=1659 Win=17520 Len=0